{
  "schema_version": "prophet.scraper.source_catalog.v0.1",
  "catalog_id": "prophet_world_side_scraper_sources",
  "opsec_defaults": {
    "run_location": "isolated_scraper_host_only",
    "never_commit": [
      "credentials",
      "session files",
      "raw scrape artifacts",
      "real onion addresses",
      "private channel exports",
      "target lists",
      "exploit payloads"
    ],
    "prompt_boundary": "Only sanitized records may leave the scraper host or be pasted into an AI prompt.",
    "network_rules": [
      "Collect only public sources unless Ayush explicitly approves a separate workflow.",
      "Respect robots.txt and published rate limits for web sources.",
      "Do not bypass login walls, CAPTCHAs, paywalls, or private invites.",
      "Do not collect credential dumps, malware binaries, exploit payloads, or victim target lists."
    ]
  },
  "lanes": {
    "official_gov_feeds": {
      "id": "official_gov_feeds",
      "description": "Official US government vulnerability and advisory feeds suitable for direct citation.",
      "collection_level": "official_record",
      "requires_isolated_host": true,
      "allowed_fields": [
        "source_id",
        "source_url",
        "title",
        "published_at",
        "updated_at",
        "cve_ids",
        "affected_products",
        "severity",
        "summary",
        "required_action",
        "reference_urls"
      ],
      "blocked_fields": [
        "credentials",
        "session_tokens",
        "exploit_payloads",
        "victim_target_lists"
      ],
      "raw_content_policy": "cache_allowed",
      "prompt_policy": "allowed_with_citation",
      "sanitized_output": "official_feed_record"
    },
    "public_technical_chatter": {
      "id": "public_technical_chatter",
      "description": "Public technical discussion indexes, advisory databases, and repository activity used as early exploit-context signals.",
      "collection_level": "public_metadata",
      "requires_isolated_host": true,
      "allowed_fields": [
        "source_id",
        "source_url",
        "title",
        "published_at",
        "updated_at",
        "cve_ids",
        "product_names",
        "tags",
        "repository",
        "author_org",
        "short_excerpt",
        "reference_urls"
      ],
      "blocked_fields": [
        "full_exploit_code",
        "weaponized_payloads",
        "scanner_output",
        "credentials",
        "private_contact_info",
        "victim_target_lists"
      ],
      "raw_content_policy": "discard_after_parse",
      "prompt_policy": "sanitized_summary_only",
      "sanitized_output": "technical_signal_record"
    },
    "public_social_chatter": {
      "id": "public_social_chatter",
      "description": "Public social posts and public community threads used only after minimization and deduplication.",
      "collection_level": "public_summary",
      "requires_isolated_host": true,
      "allowed_fields": [
        "source_id",
        "platform",
        "public_url",
        "posted_at",
        "observed_at",
        "public_author_label",
        "author_hash",
        "cve_ids",
        "product_names",
        "topic_tags",
        "engagement_counts",
        "short_excerpt"
      ],
      "blocked_fields": [
        "direct_messages",
        "private_group_posts",
        "personal_contact_info",
        "raw_thread_exports",
        "credentials",
        "doxing_material",
        "victim_target_lists"
      ],
      "raw_content_policy": "discard_after_parse",
      "prompt_policy": "sanitized_summary_only",
      "sanitized_output": "social_signal_record"
    },
    "high_risk_metadata_only": {
      "id": "high_risk_metadata_only",
      "description": "High-risk public or semi-public source families represented only by metadata labels. No endpoints, screenshots, raw text, credentials, or real hidden-service addresses belong in this repo.",
      "collection_level": "metadata_only",
      "requires_isolated_host": true,
      "allowed_fields": [
        "source_id",
        "source_category",
        "source_label",
        "topic_hash",
        "observed_at",
        "first_seen_at",
        "last_seen_at",
        "language",
        "claimed_actor",
        "claimed_region",
        "topic_tags",
        "cve_ids",
        "product_names",
        "activity_count",
        "analyst_summary"
      ],
      "blocked_fields": [
        "real_hidden_service_addresses",
        "raw_post_text",
        "screenshots",
        "credentials",
        "session_files",
        "contact_handles",
        "payment_addresses",
        "victim_target_lists",
        "malware_samples",
        "exploit_payloads"
      ],
      "raw_content_policy": "never_store",
      "prompt_policy": "metadata_only",
      "sanitized_output": "high_risk_metadata_record"
    },
    "osint_context_feeds": {
      "id": "osint_context_feeds",
      "description": "Public or API-gated context sources used only for broad geopolitical, infrastructure, transport, or exposure context. These are not target-enumeration lanes.",
      "collection_level": "public_metadata",
      "requires_isolated_host": true,
      "allowed_fields": [
        "source_id",
        "source_url",
        "title",
        "observed_at",
        "updated_at",
        "region_hint",
        "sector_hint",
        "topic_tags",
        "aggregate_count",
        "analyst_summary"
      ],
      "blocked_fields": [
        "raw_query_results",
        "asset_ip_lists",
        "credentials",
        "personal_contact_info",
        "victim_target_lists",
        "tracking_identifiers",
        "precise movement trails"
      ],
      "raw_content_policy": "discard_after_parse",
      "prompt_policy": "sanitized_summary_only",
      "sanitized_output": "osint_context_record"
    },
    "analysis_tooling_references": {
      "id": "analysis_tooling_references",
      "description": "Non-collection tools that may support visualization, simulation, or demo analysis. They are cataloged so agents do not confuse them with scrape targets.",
      "collection_level": "metadata_only",
      "requires_isolated_host": false,
      "allowed_fields": [
        "tool_id",
        "tool_url",
        "tool_name",
        "use_case",
        "analyst_summary"
      ],
      "blocked_fields": [
        "credentials",
        "session_tokens",
        "private_project_exports",
        "target_lists",
        "exploit_payloads"
      ],
      "raw_content_policy": "never_store",
      "prompt_policy": "metadata_only",
      "sanitized_output": "tool_reference_record"
    }
  },
  "sources": [
    {
      "id": "cisa_kev_json",
      "enabled": true,
      "lane": "official_gov_feeds",
      "source_type": "gov_feed",
      "display_name": "CISA Known Exploited Vulnerabilities JSON",
      "collection": {
        "method": "http_get",
        "format": "json",
        "url": "https://www.cisa.gov/sites/default/files/feeds/known_exploited_vulnerabilities.json",
        "url_template": null,
        "params": {},
        "cadence_minutes": 360,
        "auth_method": "none",
        "respect_robots_txt": true,
        "rate_limit_per_minute": 6
      },
      "normalization": {
        "record_type": "vulnerability",
        "extract_fields": [
          "cveID",
          "vendorProject",
          "product",
          "vulnerabilityName",
          "dateAdded",
          "dueDate",
          "requiredAction",
          "knownRansomwareCampaignUse",
          "notes"
        ],
        "time_field_candidates": [
          "dateAdded",
          "dueDate"
        ],
        "dedupe_keys": [
          "cveID",
          "dateAdded"
        ]
      },
      "safety": {
        "store_raw": true,
        "raw_retention_hours": 168,
        "max_text_chars": 4000,
        "prompt_eligibility": "allowed_with_citation",
        "drop_content": [
          "credentials",
          "exploit_payloads",
          "target_lists"
        ],
        "notes": "Official CISA feed; raw JSON may be cached for reproducible citation."
      },
      "relevance": {
        "stage2_use": "exploit_context",
        "default_weight": 0.95,
        "tags": [
          "kev",
          "active_exploitation",
          "official"
        ]
      }
    },
    {
      "id": "nvd_cve_api_recent",
      "enabled": true,
      "lane": "official_gov_feeds",
      "source_type": "gov_feed",
      "display_name": "NVD CVE API 2.0 Recent Changes",
      "collection": {
        "method": "api",
        "format": "json",
        "url": "https://services.nvd.nist.gov/rest/json/cves/2.0?resultsPerPage=20",
        "url_template": null,
        "params": {
          "pubStartDate": "{window_start_iso}",
          "pubEndDate": "{window_end_iso}",
          "resultsPerPage": "2000"
        },
        "cadence_minutes": 360,
        "auth_method": "none",
        "respect_robots_txt": true,
        "rate_limit_per_minute": 2
      },
      "normalization": {
        "record_type": "vulnerability",
        "extract_fields": [
          "vulnerabilities[].cve.id",
          "vulnerabilities[].cve.published",
          "vulnerabilities[].cve.lastModified",
          "vulnerabilities[].cve.descriptions",
          "vulnerabilities[].cve.references",
          "vulnerabilities[].cve.metrics",
          "vulnerabilities[].cve.weaknesses",
          "vulnerabilities[].cve.configurations"
        ],
        "time_field_candidates": [
          "published",
          "lastModified"
        ],
        "dedupe_keys": [
          "cve.id",
          "lastModified"
        ]
      },
      "safety": {
        "store_raw": true,
        "raw_retention_hours": 168,
        "max_text_chars": 4000,
        "prompt_eligibility": "allowed_with_citation",
        "drop_content": [
          "credentials",
          "exploit_payloads",
          "target_lists"
        ],